C0035,Lizard Man,Humanoid,REM 2,Common,Yes,Swamp or Tropical Forest,"A 7 foot tall cross between a lizard and a humanoid, the lizard man is green in color and blends in well with swamp vegetation.  The body of the lizard man is covered in scales and its head has the shape of a large snake or other lizard.  It has a large tail (about half the size of the body)  and clawed feet and hands.","Neither “good” or “evil” Lizard men live in their swamp villiages and mostly keep to themselves. Feared and hated because many tribes will eat humans or other humanoids (they dont really think of them as people, after all, they dont have scales) the lizard men are mostly just a neutral race that wants to be left alone.",,Particularly powerful lizard men may have a resist charm or a resist sleep (or both).  Usually only a very powerful warrior or the clan chief will have them.
C0036,"Lizard, Giant",Giant Animal,REM 2,Uncommon,Yes,Swamp or Lake,"An 8 to 10 foot long lizard, much like a giant kimodo dragon or other reptile.  Can vary in color.",,,
C0037,Manticore,Monster,REM 2,Uncommon (Rare - never run more than once an event),Yes,Any,"A lion-like creature that stands about 5 foot tall at the shoulder, it has a head resembling a humanoid with lion-like features (a mane around the face).  It has leathery black wings and a long tail with  many protruding spikes.",A monstrous predatory beast. Will kill and eat just about anything smaller than it is.,Tail Spikes:  The Manticore can fire up to four volleys of tail spikes a day. Each volley may contain up to 6 spikes.  Spikes are simulated by using throwing daggers or spell packets and inflict 3 points of no-armor damage each.,"Fly:  The manticore may fly.  It takes a slow count of five to take off or land, during which time the manticore may defends itself but may not attack."
C0038,Medusa (True Gorgon),Monster,GM or Theme Only,GM or Theme Only,No,"Ruins, Subterranian",A creature that has the lower body of a giant snake and the uppper body/torso of a humanoid female.  The tip of the snake tail has a rattle.  The hair on the humanoid head is a tangle of living serpents.,A monstrous abomination that feasts on stoned victims.  They also have some magical talent.,"Any being who meets the gaze of the Medusa(who looks directly into the eyes of the NPC playing the head/body) is turned into stone instantly, along with all of their non-demi-enchantd posses- sions.  Demi Enchanted possessions become part of the statue, (held in it?s grasp, etc) and may only be removed by destroying the statue  (inflicting Death Blows on the victim.)  This is a form of a curse, and may be reversed my a Remove Curse spell cast by a caster of 12th level or above. (or by other GM approved means)  A Medusa who meet?s its own gaze in a mirror turns to stone itself. Spells:  A Medusa knows the following Fire/Air spell slots and casts spells like a witch doctor (no spellbook needed) 4 First, 4 Second, 4 Third, and 4 Fourth level spell slots.  (Fire/Air)",
C0039,"Minotaur, Kalfoc",Monster,REM 1,Very Rare,Yes,"Any, usually mountains","A tall, humanoid shaped figure with the head of a bull.",,,
C0040,"Minotaur, Koshroc",Monster,REM 1,Very Rare,Yes,"Any, usually mountains","A tall, humanoid shaped figure with the head of a bull.",,"Gore:  The Koshroc may impale a foe on its horns.  To do this, you must thrust and land the blow, and call the attack “Gore, 8 no-armor”.",
C0041,"Minotaur, Vinyar",Monster,REM 1,Very Rare,Yes,"Any, usually mountains","A tall, humanoid shaped figure with the head of a bull.",,"Special Attacks:   Telekenesis:  As the fourth level air spell.  The Vinyar can pull the weapons from the hands of his opponents and bring them to his own.  Must strike the target with a spell packet, and announce the affect “Telekenesis, Give me your weapon”.  Does not work on magic weapons or weapons held in two hands.",
C0042,Moon Dog,Magical Animal/Monster,REM 1,Rare,yes,No,A large dog with glowing blue eyes and white and black patched fur.,"A supernatural animal touched by the positive plane.  Fairly intelligent, they are fond of “goodly” races and will protect them when possible.","Disrupt Illusions:  the whine of a Moon Dog will disrupt and dispell any illusions created by an 8th level or lower spell or an 8th level creature/caster (if not a spell).  The moon dog may use this power at will. Keep Evil at Bay:  the barking of a moon dog will drive evil creatures away, including lesser undead (Create undead 4 and lower).  Evil races like dark elves and gobliniods will avoid the area for at least an hour after hearing the bark.  It is best to  make sure all other NPC?s are aware that this NPC is on the field so they may react accordingly to it?s bark.  Greater evil beings (Greater undead, demons, etc) and PC?s are not affected by this power, but may be iritated by it.","Hypnotize evil:  Any evil creature (including undead and goblinoid races) who meets the gaze of the moon dog is affected as if by a hypnotism spell.  The moon dog will usually order the victim away. May cast the following spells at will, as an 8th level spell caster: Light (Illuminate), Dense Fog, Mask Magic May turn invisible (as the 5th level air spell) at will, for as long as it concentrates."
C0043,"Mummy, Lesser","Undead, Type 2",REM 2,Rare,Yes,Any (usually in or near burial site),A rotted corpse of a humanoid that is wrapped in rag-like cloth.,"A lesser undead minion.  Reasonably intelligent, about as inteligent as a kobold.","Disease Touch:  Any attack that penetrates the armor of a victim infects them with a light magical disease. The disease is similar to the cuase disease spell, except that it is never fatal.  The victim takes one hit point of damage per hour until he reaches zero (and falls unconcious).  The disease will not reduce the victim below zero and the victim will not die (at dawn or dusk) as he normally would.  The damage caused by this disease CAN be magically healed at any time, and the disease can be cured with a Cure Disease spell. or will run its course in 4 months.","Silver or Magical weapons and magical spells are required to strike this creature. Fire spells do double damage to this creature. Non-magical fire will do 2 points of damge each time it strikes the creature (a torch, etc). Healing magic will inflict an equivalent ammount of damage to the lesser mummy.
Immune to disease and toxins, as wel as sleep, charm, and hold spells."
C0044,"Mummy, Greater","Undead, Type  4.5",REM 1,Very Rare,yes,"Any, usually near its burial site",A rotted corpse of a humanoid that is wrapped in rag-like cloth.,"A powerful undead creature created through spells or sometimes through ancient rituals.  Fairly intelligent, if a bit slow to think.","Disease Touch:  Any character whos skin is touched by the greater mummy (an attack that penetrates armor) is infected with a powerful magical disease.  In game terms, it is a double-strength Cause Disease spell (victim loses 2 hit points per hour, and takes 2 deathblows per hour after falling to zero
hit points until dead).  The victim does not begin to feel sick until at least half of his or her body points are gone.  It takes 3 (three) Cure Disease spells to cure this potent magical disease.","Magical weapons, spells, or fire (magical or non-magical) is required to harm the Greater Mummy.
Non-magical fire, howerever, inflicts only 1 point of damage per attack.
Healing spells inflict an equivalent ammount of damage to the greater mummy.
immune to disease, toxins, sleep, charm and hold spells. Regenerates 6 hit points an hour (1 hit point every ten minuets) Must be deathblowed with fire or will regenerate and rise again."
C0045,"Naga, Guardian",Monster,REM 1,Very Rare,No,Special - Guards great treasures or important items,"A 20 foot long snake-like creature with the body of a snake and the head of a humanoid, but with reptillian eyes and pointed dragon-like ears.  The Guardian Naga?s scales are a gold color.","A powerful suprnatural monster, often used by evil spellcasters to protect their treasure, or other powerful beings to protect or watch objects of importance.  Capable Earth/Water spellcasters.","Poisonous Bite:  The Naga?s bite has a pow- erful venom.  Any victim afflicted with the poison is affected by a Death Toxin 3.  (the target dies in five minutes).  The bite must penetrate armor for the victim to recieve the poision. Poisonous Spittle:  twice a day, the Naga may spit its venom at  a victim.  If this venom touches clothing or skin (not armor or possessions) then the victim is afflicted with a Death Toxin 3 (the victim dies in five minutes).",
C0046,"Naga, Spirit",Monster,REM 2,Very Rare,Yes,"Swamp, Subterranian, Ruins","A 20 foot long snake-like creature with the body of a snake and the head of a humanoid, but with reptillian eyes and pointed dragon-like ears.  The Spirit Naga?s scales are black in color.",A powerful supernatural predator.  Capable Earth/Water AND Fire/Air Caster.  Tend to prefer to eat intelligent life.  Very cruel.,"Charm Gaze:  Any character who looks into the eyes of the NPC is affected as if by an Alliance spell, cast at 6th level. Poisonous Bite:  A combination sleeping toxin and Death 1 toxin. The victim falls asleep as soon as the combat is over, and will die within 24 hours unless purged of the toxin.  This bite must penetrate armor for the poison to affect the victim.",
C0047,"Naga, Water",Monster,REM 2,Very Rare,Yes,"Rivers, Lakes, Ponds","A 20 foot long snake-like creature with the body of a snake and the head of a humanoid, but with reptillian eyes and pointed dragon-like ears.  The Water Naga?s scales are a blue color.",Powerful supernatural predators.  Water Naga?s are the least powerful of all three types of Naga.  They haunt and hunt rivers and lake?s searching for prey to torment and eat.,Poisonous Bite:  Any attack which penetrates the armor of a victim injects them with a sleep toxin.  Victim?s fall asleep immediately.  A victim who falls asleep into the water will drown in 5 minutes and be dead.  (effective 1 deathblow per minute while submerged),
C0048,Nightmare,Negative Planar Creature/Monster,REM 2,Very Rare,Yes,"Any (as summmoned), Native to the Negative Plane","A large black horse with red glowing eyes that flicker like fire, and smoke coming out of its nostrils and mouth.","A horse like creature native to the Negative Plane, they are intelligent and often serve as mounts to more powerful negative creatures, such as Death Knights and other powerful undead or negative planar creatures. They can be summoned by powerful spellcasters and forced to serve.  Depending on how evil the person involved is, the Nightmare may serve willingly.","Fire Breath:  The Nightmare may breathe fire at an enemy for 10 points of damage.  It may do this as many times per day as it likes, though it will not use this attack in rapid sucesssion.","The Nightmare may fly, even when carrying a rider.  The Nightmare takes a slow count of five to take off or land, during which time it can only defend itself, not attack. While flying, it cannot attack or be attacked by anyone."
C0049,Nixie,Faerie/Monster,REM 2,Uncommon,Yes,Lakes,"A 4 foot tall humanoid with bluish looking skin, elven features and pointed ears.  Upon close inspection, there are gills along the sides of the neck, and webbing getween the toes and fingers.","A water-dwelling faerie kin, they often lure humans to their doom to underwater graves and slavery.","Mass Charm:  Six or more nixies in one place may cast a mass alliance spell (as the bard spell, though they do not need to sing) up to three times per day.  The duration is longer, however:  one month.  They will use this to lure humans down to be their slaves beneath the waves.",Water Breathing:  A Nixie may give another the ability to breathe water for up to one month at a time.  The Nixie may give this power to only one person each day.
C0050,Nymph,Faerie/Wild Planar Creature/Monster,REM 1,Rare,Yes,Native to the Wild Plane and dense forests on the Central Plane,"A female humanoid of exquisite beauty.  A numph looks like a human woman with elven features, or an elf with hman like features (but not the halfbreed look of a half-elf). Even females are awed by the beauty of these creatures.",Powerful woodland faerie kin and tree spirit.  Misvhevous and often times lonely.  May help someone in need or is just as likely to kill them and consume their life energy.  Capricious.,"Charming Aura:  the first time each day that a character see?s a nymph, they are affected by an Alliance spell, as if cast at 10th level.  Those who use resist charm to resist this are immune for the remainder of the day.
Death Kiss:  The Kiss of a Nymph is a Demise spell unless she wills it to be otherwise.  The Nymph may shut this power off if she so chooses.","Limited Teleport:  The Nymph may teleport up to 10 miles at will.  This power may be used 5 times per day. No holds are called, the NPC puts her hand over her head and moves to the new location (if applicable), and removes her hand from her head when she reappears."
